,English,Gaeilge
958,The children are playing in the garden.,Tá na páistí ag imirt sa ghairdín.
959,The conversation is great.,Tá an chaint go hiontach.
960,I love listening to music),Is aoibhinn liom éisteacht le ceol
961,I'm looking forward to summer),Tá mé ag súil leis an samhradh
962,"It is said that learning Irish is difficult, but it's not that difficult)","Deirtear go bhfuil sé deacair Gaeilge a fhoghlaim, ach níl sé chomh deacair sin"
963,I didn't like the movie),Níor thaitin an scannán liom
964,I love doing this),Is aoibhinn liom é seo a dhéanamh
965,I heard the news on the news),Chuala mé an scéal ar an nuacht
966,It's true that the organizations are working together),Tá sé fíor go bhfuil na hEagraíochtaí ag obair le chéile
967,It is said that Irish is a rich language),Deirtear go bhfuil an Ghaeilge ina teanga bhlasta
968,I don't know why they would close the shop),Níl a fhios agam cén fáth a dhúnfadh siad an siopa
969,I love traveling and making trips),Is breá liom taisteal agus turas a dhéanamh
970,I hope the weather will be good tomorrow),Tá súil agam go mbeidh an aimsir go maith amárach
971,He told me he would be here at seven o'clock),Dúirt sé liom go mbeadh sé anseo ar a seacht a chlog
972,I went back in time),Chuaigh mé ar ais sa lá
973,I'm looking for a new job),Táim ag lorg post nua
974,I love looking at the sky),Is breá liom amharc ar an aer
975,It's important for everyone to tackle the climate crisis),Tá sé tábhachtach do gach duine dul i ngleic leis an ngéarchéim aeráide
976,It is said that this song is groundbreaking),Deirtear go bhfuil an t-amhrán seo ina cheannródaí
977,It's not difficult to speak Irish if you're making an effort),Níl sé deacair gaeilge a labhairt mura bhfuil tú ag déanamh iarracht
978,I love coming to the coast),Is aoibhinn liom teacht ar an gcósta
979,I hope the train will be on time),Tá súil agam go mbeidh an traenach in am
980,The sun often goes on vacation.,Téann an ghrian faoi saoire go minic.
981,The bird always flies away in the garden.,Imíonn an t-éan i gcónaí sa ghairdín.
982,The weather is always beautiful on this island.,Bíonn an aimsir go hálainn ar an oileán seo.
983,The stars shine in the sky one night in December.,Fanann na réaltaí ag lonrú sa spéir oíche amháin i mí na Nollag.
984,That person stands firmly.,Seasann an duine sin ina sheasamh go crua.
985,That story is often true.,Bíonn an scéal sin fíor go minic.
986,I often hear that song on the radio.,Cloisim an t-amhrán sin go minic ar an raidió.
987,The dog goes swimming in the river every morning.,Téann an madra ag snámh san abhainn gach maidin.
988,The day rises early in summer.,Éiríonn an lá go luath sa samhradh.
989,That message scares me.,Cuireann an teachtaireacht sin eagla orm.
990,It is said that luck will come to the unpleasant.,Deirtear go dtiocfaidh an t-ádh leis an ngarbhchrannach.
991,The train leaves the station at six o'clock.,Imíonn an traein as an stáisiún ag a sé a chlog.
992,Those animals talk to each other.,Bíonn na hainmhithe sin ag caint le chéile.
993,He leaves it in the kitchen every night.,Fágann sé isteach sa chistin gach oíche.
994,The sea makes noise proudly.,Déanann an fharraige fuaim go bródúil.
995,That story always spreads throughout the country.,Imíonn an scéal sin i gcónaí ar fud na tíre.
996,The child goes out on the road completely.,Téann an páiste go léir amach ar an mbóthar.
997,I hear that folklore from my grandfather.,Cloisim an seanscéal sin ó mo sheanathair.
998,That house is always behind me.,Bíonn an teach sin ina dhiaidh orm i gcónaí.
999,The network is slow in this room.,Bíonn an líonra go mall sa seomra seo.
